title,location,postedTime,publishedAt,jobUrl,companyName,companyUrl,description,applicationsCount,contractType,experienceLevel,workType,sector,salary,posterFullName,posterProfileUrl,companyId,applyUrl,applyType,benefits
Project Manager,"New York, NY",2026-03-02,2026-03-02,https://www.linkedin.com/jobs/view/project-manager-at-omnicom-health-4298792575?refId=ZrZ%2BJWQ4W8xQ0i8aZRjH5Q%3D%3D&trackingId=WzNLGqsqezBf9zGttpYSCg%3D%3D&position=24&pageNum=0,Omnicom Health,https://www.linkedin.com/company/omnicom-health?trk=public_jobs_jserp-result_job-search-card-subtitle,"At Remedy Edge, we believe health can’t wait.The stakes are higher. The pace is faster. And hesitation costs lives.That’s why Remedy Edge exists—to bring urgency to health.Urgent thinking. Urgent creativity. Urgent action.We are a collective of courageous, curious, generous, and gritty people driven to solve the toughest challenges in healthcare. We push past convention, stay relentlessly a step ahead, and apply bold, omnichannel creativity to move people—from awareness to action, from delay to decision, from possibility to progress.Because when health is on the line, every moment matters.And every edge counts.InclusivityRemedy Edge is an inclusive home for diverse voices, perspectives, and lived experiences. We believe the best ideas emerge when everyone is heard—and when the work reflects the real world it’s meant to change. By embracing difference, we sharpen our thinking, strengthen our creativity, and take on health’s hardest problems with greater clarity and humanity.FlexibilityAt Remedy Edge, we design work around people, not the other way around. Our flexible hybrid environment empowers teams to do their best work wherever it happens: in our NYC headquarters, at home, or alongside clients. With intentional meeting-free time, seasonal flexibility, and modern ways of working, we give our people the space to think boldly, move faster, and stay at their creative edge.Who We AreRemedy Edge is a global healthcare communications network built to make creativity, and creative technology, a force for urgent health impact. Grounded in deep insight into behavior, channels, and culture, we create work that doesn’t just inform—but activates. Work that accelerates decisions, advances care, and drives meaningful change for the brands and patients who can’t afford to wait.Title: Project ManagerDepartment/Discipline: Project ManagementCompany/Location: Remedy Edge About YouYou’re a proactive team player with a strong work ethic You have a passion for process and a natural ability to help teams unite toward a common goal You excel under pressure in a fast-paced (but fun!) environment You understand the lifecycle of projects and have experience creating project plans using Microsoft Project or Smartsheets Expertly manage offline projects, digital banners, email campaigns, landing pages and microsites by consistently following and enforcing the DDBH process and following client-specific guidelines\ Prepare and upload all MLR submissions including coordination with appropriate client contacts You have a high level of proficiency with Microsoft Office You have bachelor’s degree and 2+ years of agency experience You’re a nice person Establish next-steps and daily team priorities and communicate details to team members Oversee the production and distribution of daily hot sheets, meeting notes and weekly status and financial reports Develop scope of work details (assumptions, project plan, allocations, and budget) for all print projects About The JobDevelop scope of work details (assumptions, project plan, timing, allocations, and budget) for all print projects, monitor, and communicate information to extended team Manage print and digital projects including digital banner ads, email campaigns, and websites Establish and communicate daily team priorities and next steps, lead team hot sheet and status meetings Oversee client regulatory requirements to ensure accuracy Make proactive recommendations to help ensure efficiency and quality Participate in new business pitches and special projects as assigned The range below represents the low and high end of the base salary someone in this role may earn as an employee of an Omnicom Health Group company in the United States. Salaries will vary based on various factors including but not limited to professional and academic experience, training, associated responsibilities, and other business and organizational needs. The range listed is just one component of our total compensation package for employees. Salary decisions are dependent on the circumstances of each hire.Salary range here - $70,000 - $97,000Omnicom Health is committed to hiring and developing exceptional talent. We agree that talent is uniquely distributed, and we’re focused on developing inclusive teams that can bring the best solutions to everything we do. We strongly believe that celebrating what makes us different makes us better together. Join us—we look forward to getting to know you. We will process your personal data in accordance with our Recruitment Privacy Notice.",200,Temporary,Entry level,Project Management and Information Technology,Marketing Services,,,,4298792575,https://job-boards.greenhouse.io/omnicomhealth/jobs/4902897008?gh_src=c840e9e88us,,Actively Hiring
Project Manager,"Paterson, NJ",2026-03-02,2026-03-02,https://www.linkedin.com/jobs/view/project-manager-at-epic-3849819659?refId=ZrZ%2BJWQ4W8xQ0i8aZRjH5Q%3D%3D&trackingId=CSOYj2FeeLIcN%2FeXc3%2FuZg%3D%3D&position=25&pageNum=0,Epic,https://www.linkedin.com/company/epic1979?trk=public_jobs_jserp-result_job-search-card-subtitle,"Please note that this position is based on our campus in Madison, WI, and requires relocation to the area. We recruit nationally and provide financial relocation assistance.Implementing software that saves lives.Join our Project Management team and drive impactful projects to improve patient care in healthcare organizations. Travel across the US (and abroad if you’re interested) as part of a team that leads software installations and ensures the success of newcomers to the Epic community. Use your project management skills to present to hospital leadership, coordinate end-user training, and provide comprehensive support as healthcare providers go live with our software. Enjoy autonomy in decision-making with our full support and guidance. No software experience required. Learn more about our team at https://careers.epic.com/jobs/project-manager/.Manage projects at the most innovative health systems on the planet.The top-ranked health systems in U.S. News and World Report are Epic customers. Our community includes major systems like the Mayo Clinic, Johns Hopkins, Cleveland Clinic, and Kaiser Permanente, as well as leading academic medical centers at the University of Wisconsin, University of Michigan, University of California, University of Texas, The Ohio State University, and many more.Live affordably in a city known for its rising tech talent.Epic is located just outside Madison, Wisconsin, the second fastest growing market for tech talent in the United States and home to the state capital and the University of Wisconsin. Madison, a city surrounded by water, has received accolades for being the greenest city in America (NerdWallet), the best city for renters (SmartAsset), the fittest city in America (Fitbit), and the third best metro in the US for young professionals (Forbes Advisor).More than just important work.Our uniquely themed campus was designed to heighten your ability to get stuff done in your office, a conference room, or by the fireplace in a comfy chair. All meals are restaurant-quality but cost only a few dollars, and they’re prepared by a team comprised of kitchen talent from restaurants around the country. And, after five years here, you’ll earn a four-week sabbatical anywhere in the world. Staff have kayaked in Patagonia, attended a Beyoncé concert in Ireland, built a library in Tanzania, and run a marathon in Antarctica.We offer comprehensive benefits to keep you healthy and happy as you grow in your life and career, and your merit-based compensation will reflect the impact your work has on the company and our customers. You'll also be eligible for annual raises and bonuses, as well as stock grants, which give you an even greater stake in the success of Epic and our customers. Healthcare is global, and building the best ideas from around the world into Epic software is a point of pride. As an Equal Opportunity Employer, we know that inclusive teams design software that supports the delivery of quality care for all patients, so diversity, equity, and inclusion are written into our principles. Please see our full non-discrimination statement at https://careers.epic.com/EEO.Other candidates who looked at this role also considered:Quality ManagerTrainerBachelor's degree or greater (any major)A history of academic and professional successWillingness to travel 25-60% of working days, with a typical month including 1-2 trips lasting 2-4 daysEligible to work in the United States without visa sponsorshipRelocation to the Madison, WI area (reimbursed)COVID-19 vaccination",151,Full-time,Entry level,Project Management and Information Technology,Information Technology & Services,,,,3849819659,https://epic.avature.net/Careers/RegisterMethod?folderId=19220&source=LinkedIn,,Actively Hiring
Technical Program Manager,"New York, NY",2026-03-03,2026-03-03,https://www.linkedin.com/jobs/view/technical-program-manager-at-meta-4218293884?refId=ZrZ%2BJWQ4W8xQ0i8aZRjH5Q%3D%3D&trackingId=cgTjjDLyKFI0uTZ5uQww6w%3D%3D&position=23&pageNum=0,Meta,https://www.linkedin.com/company/meta?trk=public_jobs_jserp-result_job-search-card-subtitle,"The Meta Product Technical Program Management (TPM) community is pioneering technologies to bring people (and businesses) closer together at a global scale. Product TPMs work at the cross-section between technical execution and business strategy and are expected to partner closely with Engineering and Product teams. Being a TPM at Meta means driving impact by delivering measurable results across a wide range of areas. You'll be responsible for defining and guiding high-level goals and roadmaps, monitoring and communicating progress, and defining functional requirements for new products and features. It also means having a strong technical background, understanding system architecture, and the experience to effectively collaborate across functions and organizations to deliver impact.You will be influencing technical strategy and driving execution on the company-wide platforms and services that are used across Facebook, WhatsApp, Instagram, Messenger, and Reality Labs. Teams span across Ads, Business Integrity, Commerce, Business Messaging, Privacy, Social Impact, Central Integrity, Growth, Central Metrics, Internationalization, Platforms for Family of Apps, Groups, Search, Foundation, Infra, the Metaverse, and more. This posting represents different full-time roles across the company.Technical Program Manager Responsibilities:Develop and manage end-to-end technical product solutions and ensure on-time deliveryManage cross-functional products and programs in a matrix organizationHelp define the roadmap and long-term strategy of the teams that you are working withDesign measurements to track impact and drive internal process improvementsArticulate the technology, requirements, goals and milestones of your teamCollaboratively define the vision for building Meta-scale, state-of-the-art, global productsDevelop and manage end-to-end project plans to ensure on-time delivery, provide day-to-day coordination, and quality assurance for tasksIdentify dependencies and develop mitigation strategiesMove fast in a flat organization by working in concert with technical program managers and engineers across Meta to establish a shared vision for improving execution and build solutions for privacy and security at scaleOngoing communication of planning, project status, issues and risks in a timely fashion to stakeholdersBuild bridges with product and infrastructure teams to discover adoption challenges, champion purpose use development and privacy/security product adoptionHelp drive product decisions to align with higher company initiativeBring a strong sense of execution and ownership to the teamEstablish shared goals with product teams across the company to build alignment across multiple cross-functional teams and to build and scale products for MetaMinimum Qualifications:Bachelor of Computer Science or a related technical discipline, or equivalent experience7+ years of software engineering, systems engineering, hardware engineering, or technical product/program management experienceExperience delivering tech programs or products from inception to deliveryKnowledge of user needs, gathering requirements, and defining scopeExperience operating autonomously across multiple teams, demonstrated critical thinking, and thought leadershipCommunication experience and experience working with technical management teams to develop systems, solutions, and productsOrganizational, coordination and multi-tasking experienceAnalytical and problem-solving experience with large-scale systemsExperience establishing work relationships across multi-disciplinary teams and multiple partners in different time zonesExperience working with product teams to build and deliver end-to-end customer focused products with technical knowledge of the underlying platforms and technologiesAbout Meta:Meta builds technologies that help people connect, find communities, and grow businesses. When Facebook launched in 2004, it changed the way people connect. Apps like Messenger, Instagram and WhatsApp further empowered billions around the world. Now, Meta is moving beyond 2D screens toward immersive experiences like augmented and virtual reality to help build the next evolution in social technology. People who choose to build their careers by building with us at Meta help shape a future that will take us beyond what digital connection makes possible today—beyond the constraints of screens, the limits of distance, and even the rules of physics.Meta is proud to be an Equal Employment Opportunity and Affirmative Action employer. We do not discriminate based upon race, religion, color, national origin, sex (including pregnancy, childbirth, or related medical conditions), sexual orientation, gender, gender identity, gender expression, transgender status, sexual stereotypes, age, status as a protected veteran, status as an individual with a disability, or other applicable legally protected characteristics. We also consider qualified applicants with criminal histories, consistent with applicable federal, state and local law. Meta participates in the E-Verify program in certain locations, as required by law. Please note that Meta may leverage artificial intelligence and machine learning technologies in connection with applications for employment.Meta is committed to providing reasonable accommodations for candidates with disabilities in our recruiting process. If you need any assistance or accommodations due to a disability, please let us know at accommodations-ext@meta.com.$140,000/year to $198,000/year + bonus + equity + benefitsIndividual compensation is determined by skills, qualifications, experience, and location. Compensation details listed in this posting reflect the base hourly rate, monthly rate, or annual salary only, and do not include bonus, equity or sales incentives, if applicable. In addition to base compensation, Meta offers benefits. Learn more about  benefits  at Meta.",200,Full-time,Not Applicable,Project Management and Information Technology,"Technology, Information and Internet",,,,4218293884,https://jsv3.recruitics.com/redirect?rx_cid=3239&rx_jobId=a1K2K0000036xCQUAY_1004&rx_url=https%3A%2F%2Fwww.metacareers.com%2Fjobs%2F687249053364137%2F%3Frx_campaign%3DLinkedin1%26rx_ch%3Dconnector%26rx_group%3D126320%26rx_id%3D360f49c9-126e-11f1-abca-c331c265e748%26rx_job%3Da1K2K0000036xCQUAY_1004%26rx_medium%3Dpost%26rx_r%3Dnone%26rx_source%3DLinkedin%26rx_ts%3D20260308T181208Z%26rx_vp%3Dslots%26utm_campaign%3DJob%252Bboard%26utm_medium%3Djobs%26utm_source%3DLIpaid,,Actively Hiring
Project Manager,"Saddle Brook, NJ",2026-03-06,2026-03-06,https://www.linkedin.com/jobs/view/project-manager-at-robert-half-4381980624?refId=ZrZ%2BJWQ4W8xQ0i8aZRjH5Q%3D%3D&trackingId=Ry5xpulwXwvl8Z1P3x2sGQ%3D%3D&position=20&pageNum=0,Robert Half,https://www.linkedin.com/company/robert-half-international?trk=public_jobs_jserp-result_job-search-card-subtitle,"Robert Half is seeking a highly organized and detail-oriented Project Manager to support the end-to-end development of packaging projects. In this role, you will collaborate with cross-functional teams to manage the creative production process from concept through final production. You will ensure projects move efficiently through timelines, maintain quality standards, and keep all stakeholders aligned.The ideal candidate thrives in a fast-paced environment, has a strong understanding of packaging production, and can successfully manage multiple projects simultaneously while maintaining a high level of attention to detail.Key Responsibilities·        Oversee projects from concept through production, ensuring alignment between creative, project management, and production teams.·        Manage workflows and timelines through project management systems such as Esko and Asana.·        Serve as the key liaison between Creative, Project Management, internal stakeholders, and external vendors.·        Coordinate and manage internal and external vendor proofing processes and communications.·        Attend and contribute to project review meetings, providing clear status updates and identifying potential risks or delays.·        Maintain a strong sense of urgency and attention to detail to ensure all deliverables meet quality standards and deadlines.·        Track project progress, budgets, and timelines while proactively solving challenges that may arise.·        Ensure packaging, displays, and P.O.P. materials meet pre- and post-production requirements.·        Deliver concise, actionable project updates to cross-functional teams and leadership.02720-0013395534Budget Processes, Communication, Packaging and labeling, Packaging Components, Packaging Design, Color Printing, Print Production, Print Materials, Print management, Production Schedule, Project Scheduling, Schedule Adherence, PowerPoint, Excel, Adobe Creative Suite, PDF proofing workflows﻿Qualifications·        Bachelor’s degree in Marketing, Communications, Design, or a related field.·        3–5 years of project management experience, preferably within a CPG, food &amp;  beverage, or beauty company.·        Strong understanding of the creative production process for packaging, displays, and related materials..·        Experience working with project management tools such as Esko or Asana.·        Experience coordinating internal teams and external vendors throughout the production process.·        Knowledge of package design and P.O.P. production requirements.·        Exceptional organizational, time management, and multitasking abilities.·        Excellent communication and interpersonal skills with the ability to work across diverse teams.·        Flexible, proactive, and able to adapt to changing priorities in a dynamic environment.Innovation starts with people.®Robert Half is the world’s first and largest specialized talent solutions firm that connects highly qualified job seekers to opportunities at great companies. We offer contract, temporary and permanent placement solutions for finance and accounting, technology, marketing and creative, legal, and administrative and customer support roles.Robert Half works to put you in the best position to succeed. We provide access to top jobs, competitive compensation and benefits, and free online training. Stay on top of every opportunity - whenever you choose - even on the go. Download the Robert Half app and get 1-tap apply, notifications of AI-matched jobs, and much more.All applicants applying for U.S. job openings must be legally authorized to work in the United States. Benefits are available to contract/temporary professionals, including medical, vision, dental, and life and disability insurance. Hired contract/temporary professionals are also eligible to enroll in our company 401(k) plan. Visit roberthalf.gobenefits.net for more information.© 2025 Robert Half. An Equal Opportunity Employer. M/F/Disability/Veterans. By clicking “Apply Now,” you’re agreeing to Robert Half’s Terms of Use and Privacy Notice.",25,Temporary,Mid-Senior level,"Project Management, Information Technology, and Project Management",IT Services and IT Consulting,,,,4381980624,,,Be an early applicant
Project Manager,"Newark, NJ",2026-03-03,2026-03-03,https://www.linkedin.com/jobs/view/project-manager-at-epic-3849822309?refId=ZrZ%2BJWQ4W8xQ0i8aZRjH5Q%3D%3D&trackingId=kk2Hd2Qqm%2FZiduJD85Lglw%3D%3D&position=18&pageNum=0,Epic,https://www.linkedin.com/company/epic1979?trk=public_jobs_jserp-result_job-search-card-subtitle,"Please note that this position is based on our campus in Madison, WI, and requires relocation to the area. We recruit nationally and provide financial relocation assistance.Implementing software that saves lives.Join our Project Management team and drive impactful projects to improve patient care in healthcare organizations. Travel across the US (and abroad if you’re interested) as part of a team that leads software installations and ensures the success of newcomers to the Epic community. Use your project management skills to present to hospital leadership, coordinate end-user training, and provide comprehensive support as healthcare providers go live with our software. Enjoy autonomy in decision-making with our full support and guidance. No software experience required. Learn more about our team at https://careers.epic.com/jobs/project-manager/.Manage projects at the most innovative health systems on the planet.The top-ranked health systems in U.S. News and World Report are Epic customers. Our community includes major systems like the Mayo Clinic, Johns Hopkins, Cleveland Clinic, and Kaiser Permanente, as well as leading academic medical centers at the University of Wisconsin, University of Michigan, University of California, University of Texas, The Ohio State University, and many more.Live affordably in a city known for its rising tech talent.Epic is located just outside Madison, Wisconsin, the second fastest growing market for tech talent in the United States and home to the state capital and the University of Wisconsin. Madison, a city surrounded by water, has received accolades for being the greenest city in America (NerdWallet), the best city for renters (SmartAsset), the fittest city in America (Fitbit), and the third best metro in the US for young professionals (Forbes Advisor).More than just important work.Our uniquely themed campus was designed to heighten your ability to get stuff done in your office, a conference room, or by the fireplace in a comfy chair. All meals are restaurant-quality but cost only a few dollars, and they’re prepared by a team comprised of kitchen talent from restaurants around the country. And, after five years here, you’ll earn a four-week sabbatical anywhere in the world. Staff have kayaked in Patagonia, attended a Beyoncé concert in Ireland, built a library in Tanzania, and run a marathon in Antarctica.We offer comprehensive benefits to keep you healthy and happy as you grow in your life and career, and your merit-based compensation will reflect the impact your work has on the company and our customers. You'll also be eligible for annual raises and bonuses, as well as stock grants, which give you an even greater stake in the success of Epic and our customers. Healthcare is global, and building the best ideas from around the world into Epic software is a point of pride. As an Equal Opportunity Employer, we know that inclusive teams design software that supports the delivery of quality care for all patients, so diversity, equity, and inclusion are written into our principles. Please see our full non-discrimination statement at https://careers.epic.com/EEO.Other candidates who looked at this role also considered:Quality ManagerTrainerBachelor's degree or greater (any major)A history of academic and professional successWillingness to travel 25-60% of working days, with a typical month including 1-2 trips lasting 2-4 daysEligible to work in the United States without visa sponsorshipRelocation to the Madison, WI area (reimbursed)COVID-19 vaccination",101,Full-time,Entry level,Project Management and Information Technology,Information Technology & Services,,,,3849822309,https://epic.avature.net/Careers/RegisterMethod?folderId=19220&source=LinkedIn,,Actively Hiring
