title,location,postedTime,publishedAt,jobUrl,companyName,companyUrl,description,applicationsCount,contractType,experienceLevel,workType,sector,salary,posterFullName,posterProfileUrl,companyId,applyUrl,applyType,benefits
Project Manager,United States,2026-03-06,2026-03-06,https://www.linkedin.com/jobs/view/project-manager-at-hackajob-4380636990?refId=vC2Copapkb7fO1LH%2FVV5bw%3D%3D&trackingId=87g8RztCXE7lC2j938QQjw%3D%3D&position=10&pageNum=2,hackajob,https://uk.linkedin.com/company/hackajob?trk=public_jobs_jserp-result_job-search-card-subtitle,"hackajob is collaborating with Comcast to connect them with exceptional professionals for this role.Comcast Business offers a suite of Connectivity, Communications, Networking, Cybersecurity, Wireless, and Managed Solutions to help global organizations of all sizes prepare for what’s next. Powered by the nation’s largest Gig-speed broadband network and backed by 24/7 customer support, Comcast Business is the nation’s largest technology provider to small businesses and one of the leading service providers to the Enterprise market. Comcast Business has been consistently recognized by industry analysts and associations as a leader and innovator, and one of the fastest growing providers of Ethernet services.Job SummaryResponsible for managing the complete life cycle of straight-forward to moderately complex projects, including approval, planning, execution and closeout to ensure planned results are achieved on time. Develops budgets, timelines and ensures progress-to-plan, as well as tracking critical project achievements. Works with vendors and team to establish and achieve goals. Coordinates the activities of a cross-functional team including exempt and non-exempt employees. Works with moderate guidance in own area of knowledge.Job DescriptionCore ResponsibilitiesManages all assigned projects to completion, ensuring on-time delivery, meeting of budgetary demands and maintenance of overall project ownership.Uses formal processes and tools to manage resources, budgets, risks and changes.Identifies project scope and objectives. Manages a cross-functional team including third party vendors and other resources; coordinates activities to achieve goals.Develops, maintains and manages detailed project plans, action item registers and major milestone timelines for all assigned projects. Plans and directs schedule and budget.Coordinates resources and needs, developing and maintaining regular contact with vendors for support and services.Maintains communication with stakeholders. Provides status reports to Project Managers, vendors, stakeholders and resources.Facilitates project meetings.Addresses problems through risk management and contingency planning and presents solutions and/or options to executive management.Consistent exercise of independent judgment and discretion in matters of significance.Regular, consistent and punctual attendance. Must be able to work nights and weekends, variable schedule(s) and overtime as necessary.Other duties and responsibilities as assigned.Employees At All Levels Are Expected ToUnderstand our Operating Principles; make them the guidelines for how you do your job.Own the customer experience - think and act in ways that put our customers first, give them seamless digital options at every touchpoint, and make them promoters of our products and services.Know your stuff - be enthusiastic learners, users and advocates of our game-changing technology, products and services, especially our digital tools and experiences.Win as a team - make big things happen by working together and being open to new ideas.Be an active part of the Net Promoter System - a way of working that brings more employee and customer feedback into the company - by joining huddles, making call backs and helping us elevate opportunities to do better for our customers.Drive results and growth.Support a culture of inclusion in how you work and lead.Do what's right for each other, our customers, investors and our communities.DisclaimerThis information has been designed to indicate the general nature and level of work performed by employees in this role. It is not designed to contain or be interpreted as a comprehensive inventory of all duties, responsibilities and qualifications.Comcast is an equal opportunity workplace. We will consider all qualified applicants for employment without regard to race, color, religion, age, sex, sexual orientation, gender identity, national origin, disability, veteran status, genetic information, or any other basis protected by applicable law.SkillsService Delivery; Planning; Meeting OrganizationSalaryPay Range: This job can be performed in Colorado with a Pay Range of $70,057.12 - $105,085.68Comcast intends to offer the selected candidate base pay within this range, dependent on job-related, non-discriminatory factors such as experience. The application window is 30 days from the date job is posted, unless the number of applicants requires it to close sooner or later.The application window is 30 days from the date job is posted, unless the number of applicants requires it to close sooner or later.Base pay is one part of the Total Rewards that Comcast provides to compensate and recognize employees for their work. Most sales positions are eligible for a Commission under the terms of an applicable plan, while most non-sales positions are eligible for a Bonus. Additionally, Comcast provides best-in-class Benefits to eligible employees. We believe that benefits should connect you to the support you need when it matters most, and should help you care for those who matter most. That?s why we provide an array of options, expert guidance and always-on tools, that are personalized to meet the needs of your reality ? to help support you physically, financially and emotionally through the big milestones and in your everyday life. Please visit the compensation and benefits summary on our careers site for more details.EducationBachelor's DegreeWhile possessing the stated degree is preferred, Comcast also may consider applicants who hold some combination of coursework and experience, or who have extensive related professional experience.Relevant Work Experience2-5 Years",112,Full-time,Mid-Senior level,Project Management and Information Technology,Software Development,,,,4380636990,https://www.hackajob.com/job/34fd2945-17fd-11f1-b544-0a05e249917d-project-manager?utm_source=LinkedIn&utm_medium=JobAds&utm_term=Automated&utm_campaign=comcast-project-manager&job_name=project-manager&company=comcast&workplace_type=remote&country=united-states,,Actively Hiring
Creative Project Manager,United States,2026-03-04,2026-03-04,https://www.linkedin.com/jobs/view/creative-project-manager-at-24-seven-talent-4378980781?refId=vC2Copapkb7fO1LH%2FVV5bw%3D%3D&trackingId=Lscbbr4GiZ97lsfIzGlq%2Fg%3D%3D&position=12&pageNum=2,24 Seven Talent,https://www.linkedin.com/company/24seventalent?trk=public_jobs_jserp-result_job-search-card-subtitle,"Our client, a growing CPG brand is seeking a Creative Project Manager to oversee the end-to-end execution of all creative initiatives across the business. This is a remote freelance opportunity (40 hours a week) that has potential to go fulltime for the right person. Must be US based.What you will do:? Manage end to end execution of all creative projects. Review project briefs, determine timelines and key milestones, identify and facilitate key reviewers, remove blockers.? Resource management - Ensure the right creatives (graphic designers, copywriters, video editors, etc.) are assigned to the right projects while balancing workload capacity. Monitor team bandwidth, prioritize tasks, and strategically reshuffl e as needed to support business priorities.? End to end asana management - Translate briefs into actionable, structured workfl ows. Asana will be your temple, and you will be obsessed with keeping it organized, updated, and optimized.? Act as the primary point of contact between creative teams and stakeholders. Ensure work has been reviewed by all appropriate stakeholders.? Own all review scheduling, calendar management, and status updates. Ongoing identifi cation of next steps for all projects.? Act as a central point of accountability for timelines, deliverables, and creative quality across all projects.? Obsess over workfl ow optimization. Always seek more effi cient, higher quality ways of working.? Review + troubleshoot all briefs/creative requests to ensure they’re clear and complete prior to execution. This requires a high level of critical thinking.? Risk management: Monitor project progress closely to proactively identify bottlenecks, resource constraints, and potential timeline issues, escalating to leadership when necessary.What we would like you to have:● 4–5+ years in project management, specifi cally within a creative environment.● Tools: Proficiency in a project management software (bonus points for Asana), Slack, and Google Suite familiarity.● Communication: Excellent interpersonal skills to bridge the gap between creative team members and stakeholders.● Capabilities: Strong organization, critical thinking, problem-solving, and the ability to manage multiple projects simultaneously under tight deadlines.● Obsession with optimization, always seeking ways to improve the current system.Send your resume today!",200,Contract,Mid-Senior level,Project Management,Food and Beverage Services,,,,4378980781,,,Actively Hiring
"Program Manager II, Operations, Platforms and Devices","New York, NY",2026-03-06,2026-03-06,https://www.linkedin.com/jobs/view/program-manager-ii-operations-platforms-and-devices-at-google-4381064698?refId=ZrZ%2BJWQ4W8xQ0i8aZRjH5Q%3D%3D&trackingId=ZQ64DJErrgTxwYTR6KhVVw%3D%3D&position=9&pageNum=0,Google,https://www.linkedin.com/company/google?trk=public_jobs_jserp-result_job-search-card-subtitle,"Applicants in San Francisco: Qualified applications with arrest or conviction records will be considered for employment in accordance with the San Francisco Fair Chance Ordinance for Employers and the California Fair Chance Act.Note: By applying to this position you will have an opportunity to share your preferred working location from the following: New York, NY, USA; Mountain View, CA, USA; San Francisco, CA, USA.Minimum qualifications:Bachelor's degree or equivalent practical experience.2 years of experience in program or project management.Experience collaborating across organizations to drive programs and execute on initiatives in one of the following areas: contract negotiations, commercial agreements, content management, accounting, partner or vendor management, or forecasting.Preferred qualifications:2 years of experience managing cross-functional or cross-team projects.About The JobA problem isn’t truly solved until it’s solved for all. That’s why Googlers build products that help create opportunities for everyone, whether down the street or across the globe. As a Program Manager at Google, you’ll lead complex, multi-disciplinary projects from start to finish — working with stakeholders to plan requirements, manage project schedules, identify risks, and communicate clearly with cross-functional partners across the company. Your projects will often span offices, time zones, and hemispheres. It's your job to coordinate the players and keep them up to date on progress and deadlines.Google's mission is to organize the world's information and make it universally accessible and useful. Our Devices &amp; Services team combines the best of Google AI, Software, and Hardware to create radically helpful experiences for users. We research, design, and develop new technologies and hardware to make our user's interaction with computing faster, seamless, and more powerful. Whether finding new ways to capture and sense the world around us, advancing form factors, or improving interaction methods, the Devices &amp; Services team is making people's lives better through technology.The US base salary range for this full-time position is $132,000-$189,000 + bonus + equity + benefits. Our salary ranges are determined by role, level, and location. Within the range, individual pay is determined by work location and additional factors, including job-related skills, experience, and relevant education or training. Your recruiter can share more about the specific salary range for your preferred location during the hiring process.Please note that the compensation details listed in US role postings reflect the base salary only, and do not include bonus, equity, or benefits. Learn more about benefits at Google .ResponsibilitiesDesign and deliver predictable program communication plans in collaboration with program stakeholders, including targeted communications by stakeholder type. Determine phasing and metrics associated with program lifecycle that effectively address continuous improvement including Resource Stewardship (effective deployment of machine and people resources) in close collaboration with program stakeholders, including near- and long-term objectives. Determine and collect data required to execute and govern programs effectively. Independently maintain project trackers and status reports. Identify and execute on program tasks including proactively managing dependencies. Execute change management requirements that are identified by program stakeholders. Build trusted relationships with program stakeholders, including managing expectations of program stakeholders and ensuring they have the insights they need to make effective decisions.Google is proud to be an equal opportunity workplace and is an affirmative action employer. We are committed to equal employment opportunity regardless of race, color, ancestry, religion, sex, national origin, sexual orientation, age, citizenship, marital status, disability, gender identity or Veteran status. We also consider qualified applicants regardless of criminal histories, consistent with legal requirements. See also Google's EEO Policy and EEO is the Law. If you have a disability or special need that requires accommodation, please let us know by completing our Accommodations for Applicants form .",59,Full-time,Not Applicable,"Project Management, Strategy/Planning, and Other","Information Services and Technology, Information and Internet",,,,4381064698,https://careers.google.com/jobs/results/141704873321079494-program-manager-ii/?src=Online/LinkedIn/linkedin_us&utm_source=linkedin&utm_medium=jobposting&utm_campaign=contract,,Actively Hiring
Project Manager,"Indianapolis, IN",2026-03-04,2026-03-04,https://www.linkedin.com/jobs/view/project-manager-at-rolls-royce-4380941030?refId=vC2Copapkb7fO1LH%2FVV5bw%3D%3D&trackingId=zMFoygQngjfkNPbgAKWkGQ%3D%3D&position=4&pageNum=2,Rolls-Royce,https://uk.linkedin.com/company/rolls-royce?trk=public_jobs_jserp-result_job-search-card-subtitle,"Job DescriptionJob Title: Program Manager Working Pattern: Hybrid/OnsiteWorking location: Indianapolis, IN An exciting opportunity has arisen for a Program Lead to join the US Strategic Operations team based in Indianapolis.Why Rolls-Royce?Rolls-Royce is one of the most enduring and iconic brands in the world and has been at the forefront of innovation for over a century. We design, build and service systems that provide critical power to customers where safety and reliability are paramount.We are proud to be a force for progress, powering, protecting and connecting people everywhere.We want to ensure that the excellence and ingenuity that has shaped our history continues into our future and we need people like you to come and join us on this journey.Rolls-Royce has been recognized as the top employer in the Engineering &amp; Manufacturing category on the prestigious Forbes Top Employers for Engineers list for 2025. This ranking highlights our commitment to innovation, employee development, and fostering a collaborative environment where engineers can thrive.Be part of a team that sets the industry standard and drives groundbreaking solutions.At Rolls-Royce, we are committed to creating a workplace where all employees feel respected, supported, and empowered to do their best work. We foster a welcoming and innovative work environment that invests in you, giving you access to an incredible breadth and depth of opportunities where you can grow your career and make a difference.Rolls-Royce is an Equal Opportunity Employer. All qualified applicants will receive consideration for employment without regard to any protected characteristics.What You Will Be DoingHere you will have an opportunity to work on the following:As a Program Manager you will have the necessary authority, accountability (including budget control), and responsibility for delivering an agreed scope of projects and ensuring that in creating the new capability on site they meet schedule, specification and business case requirements dependent on the stage of the program.To interface with Legacy &amp; Future Programs on Capability, Capacity and Cost requirements to support the creation, development and establishment of the multi-year strategy and executable business plan to deliver.To help establish, develop and maintain the work breakdown structure necessary to deliver strategic objectivesAssist in reporting out progression of activities and metrics associated with MA&amp;T strategy initiativesAccountable for capturing and managing capital requests that support agreed MA&amp;T strategies.Assist with identifying and managing risk mitigation strategies for MA&amp;TSupport and develop make/buy strategies for new and legacy programsOversees management of C5.1 processes and updates in ARISTo implement project management best practice for delivery of all work – milestones, critical path, risk register and cost to complete forecastingWho We’re Looking ForAt Rolls-Royce we put safety first, do the right thing, keep it simple and make a difference. These principles form the behaviours that guide us and are an essential component of our assessment process. They are the fundamental qualities that we seek for all roles.Basic QualificationsAssociate degree and 6+ years of experience Business, Supply Chain, Finance or Engineering; OR Bachelor degree and 4+ years of experience Business, Supply Chain, Finance or Engineering; ORMaster of Science degree Business, Supply Chain, Finance or Engineering; ORPhD in Business, Supply Chain, Finance or Engineering;In order to be considered for this opportunity, you must be a US Citizen or Permanent ResidentPreferredHas finance experience developing business case models for driving large investment decisionsHas supply chain and operational management experienceWhat We OfferWe offer excellent development opportunities, a competitive salary, and exceptional benefits. These include bonus, employee support assistance and employee discounts.Your needs are as unique as you are. Hybrid working is a way in which our people can balance their time between the office, home, or another remote location. It’s a locally managed and flexed informal discretionary arrangement.As a minimum we’re all expected to attend the workplace for collaboration and other specific reasons, on average three days per week.For fully remote roles, employees can live in any state except Idaho, Nebraska, Nevada, Vermont, and Wyoming.Relocation is not available for this positionClosing date: 3/18/26Job CategoryProject ManagementJob Posting Date05 Mar 2026; 00:03Pay Range$110,476 - $179,524-AnnuallyLocation:Indianapolis, INBenefitsRolls-Royce provides a comprehensive and competitive Total Rewards package that includes base pay and a discretionary bonus plan. Eligible employees may have the opportunity to enroll in other benefits, including health, dental, vision, disability, life and accidental death &amp; dismemberment insurance; a flexible spending account; a health savings account; a 401(k) retirement savings plan with a company match; Employee Assistance Program; Paid Time Off; certain paid holidays; paid parental and family care leave; tuition reimbursement; and a long-term incentive plan. The options available to an employee may vary depending on eligibility factors such as date of hire, employment type, and the applicability of collective bargaining agreements.",28,Full-time,Mid-Senior level,Project Management and Information Technology,Industrial Machinery Manufacturing,,,,4380941030,https://rollsroyce.wd3.myworkdayjobs.com/en-US/professional/job/Indianapolis/Project-Manager_JR6141210-1?source=APPLICANT_SOURCE-3-1194,,Actively Hiring
Project Manager,"Pembroke Pines, FL",2026-03-05,2026-03-05,https://www.linkedin.com/jobs/view/project-manager-at-epic-3886266985?refId=vC2Copapkb7fO1LH%2FVV5bw%3D%3D&trackingId=4lGlyiFbn45Dnbt3VUs8ag%3D%3D&position=11&pageNum=2,Epic,https://www.linkedin.com/company/epic1979?trk=public_jobs_jserp-result_job-search-card-subtitle,"Please note that this position is based on our campus in Madison, WI, and requires relocation to the area. We recruit nationally and provide financial relocation assistance.Implementing software that saves lives.Join our Project Management team and drive impactful projects to improve patient care in healthcare organizations. Travel across the US (and abroad if you’re interested) as part of a team that leads software installations and ensures the success of newcomers to the Epic community. Use your project management skills to present to hospital leadership, coordinate end-user training, and provide comprehensive support as healthcare providers go live with our software. Enjoy autonomy in decision-making with our full support and guidance. No software experience required. Learn more about our team at https://careers.epic.com/jobs/project-manager/.Manage projects at the most innovative health systems on the planet.The top-ranked health systems in U.S. News and World Report are Epic customers. Our community includes major systems like the Mayo Clinic, Johns Hopkins, Cleveland Clinic, and Kaiser Permanente, as well as leading academic medical centers at the University of Wisconsin, University of Michigan, University of California, University of Texas, The Ohio State University, and many more.Live affordably in a city known for its rising tech talent.Epic is located just outside Madison, Wisconsin, the second fastest growing market for tech talent in the United States and home to the state capital and the University of Wisconsin. Madison, a city surrounded by water, has received accolades for being the greenest city in America (NerdWallet), the best city for renters (SmartAsset), the fittest city in America (Fitbit), and the third best metro in the US for young professionals (Forbes Advisor).More than just important work.Our uniquely themed campus was designed to heighten your ability to get stuff done in your office, a conference room, or by the fireplace in a comfy chair. All meals are restaurant-quality but cost only a few dollars, and they’re prepared by a team comprised of kitchen talent from restaurants around the country. And, after five years here, you’ll earn a four-week sabbatical anywhere in the world. Staff have kayaked in Patagonia, attended a Beyoncé concert in Ireland, built a library in Tanzania, and run a marathon in Antarctica.We offer comprehensive benefits to keep you healthy and happy as you grow in your life and career, and your merit-based compensation will reflect the impact your work has on the company and our customers. You'll also be eligible for annual raises and bonuses, as well as stock grants, which give you an even greater stake in the success of Epic and our customers. Healthcare is global, and building the best ideas from around the world into Epic software is a point of pride. As an Equal Opportunity Employer, we know that inclusive teams design software that supports the delivery of quality care for all patients, so diversity, equity, and inclusion are written into our principles. Please see our full non-discrimination statement at https://careers.epic.com/EEO.Other candidates who looked at this role also considered:Quality ManagerTrainerBachelor's degree or greater (any major)A history of academic and professional successWillingness to travel 25-60% of working days, with a typical month including 1-2 trips lasting 2-4 daysEligible to work in the United States without visa sponsorshipRelocation to the Madison, WI area (reimbursed)COVID-19 vaccination",166,Full-time,Associate,Project Management and Information Technology,Information Technology & Services,,,,3886266985,https://epic.avature.net/Careers/RegisterMethod?folderId=19220&source=LinkedIn,,Actively Hiring
