title,location,postedTime,publishedAt,jobUrl,companyName,companyUrl,description,applicationsCount,contractType,experienceLevel,workType,sector,salary,posterFullName,posterProfileUrl,companyId,applyUrl,applyType,benefits
Development Project Manager,"New York, NY",2026-03-04,2026-03-04,https://www.linkedin.com/jobs/view/development-project-manager-at-shake-shack-4381134247?refId=ZrZ%2BJWQ4W8xQ0i8aZRjH5Q%3D%3D&trackingId=sg%2BvMIjAdp56jqJ7RVIdYQ%3D%3D&position=8&pageNum=0,Shake Shack,https://www.linkedin.com/company/shakeshack?trk=public_jobs_jserp-result_job-search-card-subtitle,"Our secret to leading the way in hospitality? We put our people first!At Shake Shack, our mission is to Stand For Something Good in all that we do. From our teams to our neighborhoods, we're committed to always doing the right thing. As one of the fastest-growing hospitality brands, we're all about crafting unforgettable experiences for our guests. We offer endless learning opportunities and the chance to make a lasting impact on our business, restaurants, and communities. As a member of the #ShackFam, you’ll have access to hands-on mentorship, training, and growth potential, all in a fun and inclusive environment.Join us and Be a Part of Something Good.Job SummaryThe Development Project Manager is responsible for supporting and managing the full pre-construction process for assigned new store development projects, from site handoff through construction start. This role is responsible for hands-on project coordination and execution, including developing and tracking schedules, managing project pacing, and supporting execution plans to help deliver projects on schedule, within scope, and aligned with organizational goals. The Development Project Manager partners closely with internal cross-functional teams and external stakeholders to support project delivery, with an emphasis on landlord coordination, entitlements, permitting, and clear communication. This role operates with guidance from the Senior Manager, Development while owning day-to-day project details and follow-through.Job Responsibilities And DutiesManage assigned development projects from site handoff through construction start, supporting overall schedules, landlord deliverables, entitlements, and permitting activities. Develop and maintain project execution plans and schedules for assigned projects, tracking timelines and key milestones in alignment with landlord delivery requirements and departmental priorities. Monitor project progress and day-to-day tasks, proactively identifying risks or blockers and escalating issues to leadership as needed to maintain schedule, budget, and quality targets. Serve as a primary day-to-day point of contact for assigned projects, coordinating with internal teams, external consultants, and landlords under the guidance of senior development leadership. Coordinate cross-functionally with real estate, design, permitting, pre-construction, and construction teams to support task resolution and ensure timely completion of project requirements. Maintain and update project schedules, budgets, and status reports for assigned projects; communicate risks, changes, and delays clearly to senior leadership. Support entitlement and permitting activities for assigned sites, coordinating with consultants, municipalities, and internal partners to advance approvals. Participate in regional pipeline meetings; track assigned action items and support follow-through. Lead and support internal project kickoffs meetings and due diligence reviews for assigned projects, assisting with preparation, documentation, and next-step tracking. Establish and monitor development budgets for assigned projects, flagging variances or concerns to leadership. Attend project meetings and provide clear updates on schedules, risks, and outstanding actions for projects. Conduct site visits as needed to support verification of landlord work progress and assist in coordinating resolution of deficiencies. Contribute to process improvement initiatives by providing feedback and insights based on hands-on project execution experience. Collaborate closely with the Permitting Manager and broader permitting team, supporting alignment and information flow for assigned projects. Knowledge, Skills, AbilitiesStrong project management skills with the ability to manage multiple concurrent projects. Strong understanding of end-to-end development processes, with expertise in entitlements and permitting. Experience developing and executing project schedules, pacing, and project execution plans. Exceptional communication, organization, and cross-functional collaboration skills. Ability to operate effectively with direction while managing day-to-day execution independently. Proficiency in project tracking tools and scheduling software; Excel and Microsoft Office required. Proficiency in Microsoft Project, Smartsheet, and Bluebeam preferred. Domestic travel required. Education RequirementsBachelor's DegreeEducation or Certificate DetailsDegree in Real Estate, Construction, Architecture, Interior Design or EngineeringWork Experience4-6 years of progressive experience in a real estate development, design project management, construction project management, or related field managing multiple concurrent projects in a fast-paced environmentRelated ExperienceReal Estate Development Construction Project Management Architecture/Engineering Tenant Coordination Permitting and Entitlements Physical RequirementsPrecise hand/eye coordinationBasic keyboarding or other repetitive motionsBenefits At Shake ShackA work environment where you can come as you are, share your ideas, have fun, and work collaboratively:Weekly Pay and Performance bonusesShake Shack Meal DiscountsExclusive corporate discounts for travel, electronics, wellness, leisure activities and moreMedical, Dental, and Vision Insurance*Employer Paid Life and Disability Insurance*401k Plan with Company Match*Paid Time Off*Paid Parental Leave*Access to Employee Assistance Program on Day 1Pre-Tax Commuter and Parking BenefitsFlexible Spending and Dependent Care Accounts*Development and Growth OpportunitiesEligibility criteria appliesPay Range - $103,050.00 - $135,300.00Click the ""Apply"" button above to apply for this opening.About UsBeginning as a hot dog cart in New York City’s Madison Square Park, Shake Shack was created by Danny Meyer, Founder and CEO of Union Square Hospitality Group and best-selling author of Setting the Table. Shack Fans lined up daily, making the cart a resounding success, and donating all proceeds back to the park beautification efforts. A permanent stand was eventually built…and the rest is Shack history! With our roots in fine dining and giving back to the community, we are committed to high quality food served with a high level of hospitality. Our team members enjoy a positive work environment that is deeply committed to the philosophy that we ""Stand for Something Good.""Shake Shack is an Equal Opportunity Employer All qualified applicants will receive consideration for employment without regard to any protected characteristic, including race, color, ancestry, national origin, religion, creed, age, disability (mental and physical), sex, gender identity, sexual orientation, gender expression, medical condition, genetic information, marital, military and veteran status.",85,Full-time,Mid-Senior level,Project Management and Information Technology,"Restaurants, Food and Beverage Services, and Retail",,,,4381134247,https://jsv3.recruitics.com/redirect?rx_cid=3568&rx_jobId=JR11659-3&rx_url=https%3A%2F%2Fcareers.shakeshack.com%2Fdevelopment-project-manager%2Fjob%2FPAF-SS-C903FCFF-A7B5-4DCF-9DEF-D54F9542BFDB_26631_1770855311_0%3Frx_campaign%3DLinkedin1%26rx_ch%3Dconnector%26rx_group%3D359717%26rx_id%3D1e18f3f0-17bf-11f1-942d-918e6a33e602%26rx_job%3DJR11659-3%26rx_medium%3Dpost%26rx_r%3Dnone%26rx_source%3DLinkedin%26rx_ts%3D20260308T121305Z%26rx_vp%3Dslots%26source%3DRecruitics_LinkedIn&source=LinkedIn,,Actively Hiring
Associate Project Manager - Central,United States,2026-03-06,2026-03-06,https://www.linkedin.com/jobs/view/associate-project-manager-central-at-cyara-4382171795?refId=1rra1FEyT4KPoF1u5xkKVg%3D%3D&trackingId=Zm6DBO1miSkXqH1HQE7feQ%3D%3D&position=25&pageNum=1,Cyara,https://www.linkedin.com/company/cyara?trk=public_jobs_jserp-result_job-search-card-subtitle,"Cyara is the global leader in AI-powered customer experience assurance, committed to eradicating bad CX. As the only unified platform for continuous testing and monitoring across voice, digital, messaging, and conversational AI channels, Cyara empowers hundreds of the world’s leading brands to optimize more than 350 million customer journeys every year. With enterprises rapidly deploying agentic AI systems that adapt, learn, and make autonomous decisions in real time, Cyara provides the assurance layer that turns pilots into production-ready deployments—testing AI agents with AI agents to catch what scripts can’t. From full journey visibility to AI governance, trust validation, and compliance, Cyara ensures every touchpoint works flawlessly and every AI interaction solves customer problems while delighting them in the process. Cyara helps businesses deliver secure, friction-free, and high-quality CX at scale. Interested to find out more about us? Check out: www.cyara.comCyara’s Diversity, Equity, Inclusive and Belonging Statement:At Cyara, we are dedicated to fostering a workplace that embodies equal opportunity and champions diversity, equity, inclusion, and belonging (DEIB). We strive to cultivate an environment where every individual feels valued, respected, and empowered to bring their whole selves to work, contributing unique perspectives and talents. Our commitment includes continuously evaluating and enhancing our policies, practices, and culture to align with our DEIB principles. We ensure a discrimination-free environment where individuals are evaluated solely on their merits and abilities, regardless of legally protected statuses such as sex, race, color, ethnicity, national origin, age, religion, disability, sexual orientation, gender identity, veteran status, or medical condition. By celebrating our differences and championing inclusivity, we enrich our organization, make more thoughtful decisions, and drive collective success.Cyara’s Values Statement: At Cyara, our values shape everything we do. We're passionate about Delivering Excellence by putting the customer first, collaborating globally, and always striving to improve. We take smart risks and Innovate Boldly, setting new standards and learning from every experience. Integrity First is our cornerstone—we value humility, authenticity, and respect for diversity, building trust in all we do. We Embrace Curiosity by empowering you to experiment, learn, and grow in a dynamic environment. At Cyara, our values drive us forward, shaping a culture where innovation and excellence thrive.What We’re Looking For: We are looking for an Associate Project Management Professional to join our Professional Services organization. The Professional Services organization focuses on all aspects of delivering the post-sales solutions, with a mission to delight our customers, help them achieve success and create customers for life. We need a project manager who is a highly organized and proactive individual we can entrust with keeping projects on track and delivering within the full expectation of the customer. We are seeking someone who can maintain high levels of engagement with these customers and deliver an elevated level of service to drive customer satisfaction and loyalty.The Experience You Have: This is an associate or junior level position. You have some experience in managing projects, are familiar with project management principles and are eager to learn!Location: The ideal candidate for this position must be located in the Central time zone.Responsibilities: Our Associate Project Managers work closely with Senior and Principal Project Managers and are expected to own delivery of assigned projects from start to finish with guidance. As an Associate Project Manager, your activities include:Manage, monitor and control assigned project deliverables, including reviewing project scope with respect to scheduling, resourcing, communications and change management with the assistance of Senior team membersMonitor and control assigned project progress, including using change management and escalations to the Principal Project Manager and/or Project Management Office where necessary, to ensure projects are delivered on time and within budgetDevelop, manage, control and maintain project reporting and documentationInteract and work collaboratively with staff and potential service providersBuild strong relationships with all clientsQualifications/Skills:Excellent interpersonal skills with ability to foster strong internal and external relationshipsA strong customer and team focusA strong sense of professionalism, diligence and an eye for detail, consistently delivering work of a high qualityStrong written and spoken communication skills, conveying ideas/decisions effectivelyWork cohesively and efficiently within a team as well as with other teamsExcellent time management skills with the ability to prioritize and handle multiple tasks and projectsDesirable Experience:Experience with core project management processes such as planning, scheduling, and risk managementKnowledge of project management tools such as Microsoft Project and ExcelCulture Fit: You are the kind of person who acts with integrity in all you do, you value people and establish trusted relationships, you care deeply about the customer experience and pride yourself on delivering an elevated level of service, you are highly organized and responsive, you are proactive and always seeking improvement and never satisfied with the status quo, you are comfortable moving fast and making decisions quickly, you value individuals but are known for making teams come together across functional lines.Reporting: This position reports to the Principal Project Manager.Education: AA/AS required, BS/BA desirableWhy you should join us: At Cyara you’ll have the opportunity to work with a group of people who share common goals, are driven by a similar passion, and value the expertise of their peers. Cyara is committed to being an equal opportunity employer, focused on building and maintaining a diverse, inclusive and authentic workplace; and a work environment that is free from discrimination and harassment, based upon any legally protected status or protected characteristic, including but not limited to an individual's sex, race, color, ethnicity, national origin, age, religion, disability, sexual orientation, veteran status, gender identity, or pregnancy. At Cyara we appreciate and welcome the fact that our culture is living and growing as we continue to evolve over time. With this opportunity comes the chance to enjoy a flexible work environment, competitive compensation and a work culture that's results-oriented, fast-paced and focused on continuous improvement, whilst maintaining a family first, team oriented, and ever positive atmosphere.Cyara cares for its own - you’ll feel that on your first day - and you'll get the chance to work for a global, growing company, and an all-inclusive team of innovators. We credit our amazing growth and success to the fact that we’ve built our business on four essential values that we live and breathe every day:Deliver Excellence Innovate BoldlyIntegrity FirstEmbrace CuriosityInterested? Know someone who might be? Apply online now.Agencies: Thanks, but we’ve got this one! Please, no phone calls or emails to any employees of Cyara outside of the Talent Acquisition team. Cyara’s policy is to only accept resumes from Agencies via the Cyara Agency Portal. Agencies must have a valid fee agreement in place, and they must have been assigned the specific requisition to which they submit resumes, by the Cyara Talent Acquisition team before submitting any CVs. Any resume submitted outside of this process will be deemed the sole property of Cyara and, in the event, a candidate is submitted outside of this policy is hired, no fee or payment of any kind will be paid.We may use artificial intelligence (AI) tools to support parts of the hiring process, such as reviewing applications, analyzing resumes, or assessing responses. These tools assist our recruitment team but do not replace human judgment. Final hiring decisions are ultimately made by humans. If you would like more information about how your data is processed, please contact us.This range indicates OTE. Individual pay is determined by skills, qualifications, experience, and location.",200,Full-time,Mid-Senior level,Project Management and Information Technology,"IT Services and IT Consulting, Professional Training and Coaching, and Business Consulting and Services",,,,4382171795,,,Actively Hiring
"Project Manager, Store Planning and Construction - North America","New York, NY",2026-03-08,2026-03-08,https://www.linkedin.com/jobs/view/project-manager-store-planning-and-construction-north-america-at-tiffany-co-4278288434?refId=ZrZ%2BJWQ4W8xQ0i8aZRjH5Q%3D%3D&trackingId=Q86E%2FxnAjeYzb%2BpeICJK2Q%3D%3D&position=14&pageNum=0,Tiffany & Co.,https://www.linkedin.com/company/tiffany-and-co?trk=public_jobs_jserp-result_job-search-card-subtitle,"Job DescriptionOverview:The Project Manager, Store Planning and Construction will lead the delivery of Tiffany &amp; Co.’s retail and trade projects, ensuring every initiative is completed on time, within budget, and to the highest standards of quality. This role requires a strategic thinker who can also dive into the day-to-day execution, balancing operational rigor with a focus on clients, people, and brand desirability. Acting as a collaborative partner across central and local teams, they will embody openness, transparency, and mutual support. Above all, they will champion our core belief—People Make the Difference—and bring to life our values: Be Creative &amp; Innovative, Deliver Excellence, and Cultivate an Entrepreneurial Spirit.Key Accountabilities:Planning, sales growth Build project briefs, programs/schedules and budgets that respect the Store Development Lifecycle and key project milestones. Manage and build project brief with all stakeholders. Align with Store Design, Regional and Market leadership and all stakeholders on project milestones and overall schedule. Review and negotiate work letters with LL and conduct initial site reviews. Advise on market conditions that effect schedule and budget. Drive and respect the critical milestones and deliverables of the lifecycle to achieve project approvals and funding. Agility to adapt the lifecycle to achieve quicker openings which in turn benefit sales and market growth. Leverage project resources of architects, supplies, and GC’s to achieve project schedules.Execution Manage approved schedules to achieve all critical milestones. Adjust and update as needed during the lifecycle of a project. Manage TCO stakeholders’ (store design, Procurement, IT, Security, Merchandising, Ops), external consultants (architects, engineers, etc.), and general contractors and suppliers to achieve committed milestones. Coordinate and manage drawing sets and milestones from schematic and design development, and construction documents. Review dwgs and conduct page turns at milestones. Utilize TCO systems (unifier, Coupa, PlanGrid, Microsoft Projects) for drawing and budget, PO submissions and management. Manage budgets during the lifecycle. Call out and manage risk at lifecycle milestones. Value engineer with Store Design if required. Establish competitive bidding, contract administration and project related legal and financial controls. Build proper bid books, cost plans, forecasts, budget history and issue POs for a proper project buyout. Attend and manage monthly cost mtgs to ensure compliance with project budget, forecast, PO issuance, contingency management, change orders, cash flow and close out. Close out project in 90 days after store opening for all vendors and supplies. Maintain excellent relationships with contractors, consultants, designers and internal customers.Oversee constructionEnsure weekly OAC meetings are conducted and documented. Coordination with procurement that OFI goods are on schedule. Manage and report on change orders and overall budget management. Build to high quality and handover store to retail team 100% defect free. Handover of store to be coordinated with all stakeholders for a seamless transition from store planning to Retail. Travel as required to conduct site visits during the lifecycle of the project.Efficiencies / Continuous Improvements Regularly visit completed projects with members of Store Design, Procurement, Store Planning and Retail to perform post-opening project audits. Identify areas of needed improvement and institute changes to store design, project development &amp; delivery, materials, and suppliers. Support Store Design and Procurement with their on-going research and development programs. Identify and support the prototyping of project components. Identify regional/local resources, materials, suppliers for cost and schedule efficiencies. Work in collaboration with Procurement and Store Design to propose and implement programs to exploit efficiencies. Analyze standards, cost efficiencies and suppliersQualifications:Bachelor’s Degree in Architecture, or Construction Project management4+ years of experience within a store planning/design/construction environment involving an aggressive expansion of retail storesExperience in Luxury marketExperience collaborating with vendors and consultants in the North America market.Effective communication and managerial skillsTraveling (approximately 35%) is requiredProficient with Microsoft Office, AutoCADThe hiring range for this position ranges from $160,000-$170,000. The rate of pay offered will be dependent upon candidates’ relevant skills and experience. Management is also eligible for bonus.",200,Full-time,Mid-Senior level,Project Management and Information Technology,"Retail Apparel and Fashion, Retail, and Retail Luxury Goods and Jewelry",,,,4278288434,https://eljs.fa.us2.oraclecloud.com/hcmUI/CandidateExperience/en/job/61646/?utm_medium=jobshare&mode=job&iis=LinkedIn,,Actively Hiring
