title,location,postedTime,publishedAt,jobUrl,companyName,companyUrl,description,applicationsCount,contractType,experienceLevel,workType,sector,salary,posterFullName,posterProfileUrl,companyId,applyUrl,applyType,benefits
Agile Project Manager,United States,2026-03-04,2026-03-04,https://www.linkedin.com/jobs/view/agile-project-manager-at-crg-4379463799?refId=IoRLuH7p%2FukEn0YziwPsPA%3D%3D&trackingId=Y%2F89HjEWgOyzHr64sVbXYg%3D%3D&position=24&pageNum=0,CRG,https://www.linkedin.com/company/crg-corporation?trk=public_jobs_jserp-result_job-search-card-subtitle,"Location: 100% RemoteDuration: 6-months contractPay: $65-70/hour W2Job DescriptionOur Retail client with over $80B in annual revenue has over 2,000 stores, across 21 US states, with over 400,000 employees. This company is a leader in sustainable retailing with a passion for delivering excellence. By driving omni channel growth, efficiency in the shopping experience and continuing to develop with new technologies; this company is growing and developing continuing success. The leadership team strives for work-life balance for all its employees, with options for overtime if desired.Responsible for facilitating all the scrum ceremonial meetings like the Daily Scrum, Sprint planning, Sprint Demo/Review &amp; retrospectives.Helps the Product Owner and Scrum team create &amp; maintain a healthy product backlog and helps the team in continuously managing &amp; prioritizing the backlog.Helps the team plan sprints based on team capacity, remove impediments that may hinder progress and continuously monitor sprint progress and assist the team in meeting the Sprint commitments.RESPONSIBILITIESTrack team(s) velocity and publish metrics like velocity charts, sprint burn up/down charts and release burn up/down charts.Create, set up and maintain the Scrum/Kanban JIRA/ADS boards for the team and ensure all work is tracked and updated regularly on the board.Manage the overall scope of the project and negotiate with the PO/business on priority and what can be accomplished by the team.Protect the team from outside interruptions and distractions.Build out a sprint calendar, release plan(s) and manage the overall timeline &amp; delivery of the project.Review project team allocations, project related POs/invoices &amp; manage the project financials.Reporting &amp; CommunicationIdentify, track, manage, escalate and report on risks and issues.Create &amp; publish weekly Clarity project status reports &amp; host Steering Committee meetings.Negotiate and align the expectations with the capacity/ commitment and the team deliverables.Keep the RTE/ Program Manager and Portfolio lead informed of the milestones/ deliverables of the team.Escalate as needed to remove impediments for the team.Coaching &amp; People LeadershipEstablish an environment for the team to thrive and bring out the best in them. Motivate the team and build positive, lasting relationships with the team and other stakeholders.Coach the team on Agile best practices and help the team continually improve by using retrospective meetings as learning and adjust/improve based on the findings/recommendations.Category Code: JN008",200,Contract,Mid-Senior level,Project Management and Information Technology,Food and Beverage Services and Food and Beverage Retail,,Madison di Zerega,https://www.linkedin.com/in/madisondizerega,4379463799,,,"Actively Hiring
           +5 benefits"
Project Manager,"New York, NY",2026-03-04,2026-03-04,https://www.linkedin.com/jobs/view/project-manager-at-mphasis-4381110164?refId=ZrZ%2BJWQ4W8xQ0i8aZRjH5Q%3D%3D&trackingId=d%2BiHFxZMY0o%2BuXTLD03a8g%3D%3D&position=15&pageNum=0,Mphasis,https://in.linkedin.com/company/mphasis?trk=public_jobs_jserp-result_job-search-card-subtitle,"The ideal candidate will be responsible for business operations functions like reporting, financial governance, contract tracking, resource management, and PMO operations within the decided-upon budget, timeline, and scope. They will also effectively monitor and present project updates to relevant stakeholders, clients, or project team members.  Key Responsibilities Manage financial reporting, forecasting, invoicing governance. Coordinate resource planning, hiring status, and onboarding metrics. Build dashboards, MIS reports, and compliance documentation. Support executive governance with presentations and status reports. Act as PMO lead for audits, procurement, contract compliance. Required Skills Strong analytical and documentation skills Experience with MS Excel, Power BI, and PMO tools Financial governance knowledge Experience 10–15 years in PMO/business operationsQualificationsBachelor's Degree or equivalent experienceStrong business acumen in project planning and managementPMP CertifiedStrong verbal, written, and organizational skills",25,Full-time,Mid-Senior level,Information Technology,IT Services and IT Consulting,,Harish B,https://in.linkedin.com/in/harish-b-9b914067,4381110164,,,Be an early applicant
Project Manager,"San Francisco, CA",2026-03-02,2026-03-02,https://www.linkedin.com/jobs/view/project-manager-at-epic-3849821034?refId=IoRLuH7p%2FukEn0YziwPsPA%3D%3D&trackingId=O9T%2FFybtwOquRwIFeR1ZDA%3D%3D&position=23&pageNum=0,Epic,https://www.linkedin.com/company/epic1979?trk=public_jobs_jserp-result_job-search-card-subtitle,"Please note that this position is based on our campus in Madison, WI, and requires relocation to the area. We recruit nationally and provide financial relocation assistance.Implementing software that saves lives.Join our Project Management team and drive impactful projects to improve patient care in healthcare organizations. Travel across the US (and abroad if you’re interested) as part of a team that leads software installations and ensures the success of newcomers to the Epic community. Use your project management skills to present to hospital leadership, coordinate end-user training, and provide comprehensive support as healthcare providers go live with our software. Enjoy autonomy in decision-making with our full support and guidance. No software experience required. Learn more about our team at https://careers.epic.com/jobs/project-manager/.Manage projects at the most innovative health systems on the planet.The top-ranked health systems in U.S. News and World Report are Epic customers. Our community includes major systems like the Mayo Clinic, Johns Hopkins, Cleveland Clinic, and Kaiser Permanente, as well as leading academic medical centers at the University of Wisconsin, University of Michigan, University of California, University of Texas, The Ohio State University, and many more.Live affordably in a city known for its rising tech talent.Epic is located just outside Madison, Wisconsin, the second fastest growing market for tech talent in the United States and home to the state capital and the University of Wisconsin. Madison, a city surrounded by water, has received accolades for being the greenest city in America (NerdWallet), the best city for renters (SmartAsset), the fittest city in America (Fitbit), and the third best metro in the US for young professionals (Forbes Advisor).More than just important work.Our uniquely themed campus was designed to heighten your ability to get stuff done in your office, a conference room, or by the fireplace in a comfy chair. All meals are restaurant-quality but cost only a few dollars, and they’re prepared by a team comprised of kitchen talent from restaurants around the country. And, after five years here, you’ll earn a four-week sabbatical anywhere in the world. Staff have kayaked in Patagonia, attended a Beyoncé concert in Ireland, built a library in Tanzania, and run a marathon in Antarctica.We offer comprehensive benefits to keep you healthy and happy as you grow in your life and career, and your merit-based compensation will reflect the impact your work has on the company and our customers. You'll also be eligible for annual raises and bonuses, as well as stock grants, which give you an even greater stake in the success of Epic and our customers. Healthcare is global, and building the best ideas from around the world into Epic software is a point of pride. As an Equal Opportunity Employer, we know that inclusive teams design software that supports the delivery of quality care for all patients, so diversity, equity, and inclusion are written into our principles. Please see our full non-discrimination statement at https://careers.epic.com/EEO.Other candidates who looked at this role also considered:Quality ManagerTrainerBachelor's degree or greater (any major)A history of academic and professional successWillingness to travel 25-60% of working days, with a typical month including 1-2 trips lasting 2-4 daysEligible to work in the United States without visa sponsorshipRelocation to the Madison, WI area (reimbursed)COVID-19 vaccination",158,Full-time,Entry level,Project Management and Information Technology,Information Technology & Services,,,,3849821034,https://epic.avature.net/Careers/RegisterMethod?folderId=19220&source=LinkedIn,,Actively Hiring
Project Manager,"Miami, FL",2026-03-03,2026-03-03,https://www.linkedin.com/jobs/view/project-manager-at-epic-3849820342?refId=IoRLuH7p%2FukEn0YziwPsPA%3D%3D&trackingId=xyKKADALcnEc9ADahA5Q4g%3D%3D&position=25&pageNum=0,Epic,https://www.linkedin.com/company/epic1979?trk=public_jobs_jserp-result_job-search-card-subtitle,"Please note that this position is based on our campus in Madison, WI, and requires relocation to the area. We recruit nationally and provide financial relocation assistance.Implementing software that saves lives.Join our Project Management team and drive impactful projects to improve patient care in healthcare organizations. Travel across the US (and abroad if you’re interested) as part of a team that leads software installations and ensures the success of newcomers to the Epic community. Use your project management skills to present to hospital leadership, coordinate end-user training, and provide comprehensive support as healthcare providers go live with our software. Enjoy autonomy in decision-making with our full support and guidance. No software experience required. Learn more about our team at https://careers.epic.com/jobs/project-manager/.Manage projects at the most innovative health systems on the planet.The top-ranked health systems in U.S. News and World Report are Epic customers. Our community includes major systems like the Mayo Clinic, Johns Hopkins, Cleveland Clinic, and Kaiser Permanente, as well as leading academic medical centers at the University of Wisconsin, University of Michigan, University of California, University of Texas, The Ohio State University, and many more.Live affordably in a city known for its rising tech talent.Epic is located just outside Madison, Wisconsin, the second fastest growing market for tech talent in the United States and home to the state capital and the University of Wisconsin. Madison, a city surrounded by water, has received accolades for being the greenest city in America (NerdWallet), the best city for renters (SmartAsset), the fittest city in America (Fitbit), and the third best metro in the US for young professionals (Forbes Advisor).More than just important work.Our uniquely themed campus was designed to heighten your ability to get stuff done in your office, a conference room, or by the fireplace in a comfy chair. All meals are restaurant-quality but cost only a few dollars, and they’re prepared by a team comprised of kitchen talent from restaurants around the country. And, after five years here, you’ll earn a four-week sabbatical anywhere in the world. Staff have kayaked in Patagonia, attended a Beyoncé concert in Ireland, built a library in Tanzania, and run a marathon in Antarctica.We offer comprehensive benefits to keep you healthy and happy as you grow in your life and career, and your merit-based compensation will reflect the impact your work has on the company and our customers. You'll also be eligible for annual raises and bonuses, as well as stock grants, which give you an even greater stake in the success of Epic and our customers. Healthcare is global, and building the best ideas from around the world into Epic software is a point of pride. As an Equal Opportunity Employer, we know that inclusive teams design software that supports the delivery of quality care for all patients, so diversity, equity, and inclusion are written into our principles. Please see our full non-discrimination statement at https://careers.epic.com/EEO.Other candidates who looked at this role also considered:Quality ManagerTrainerBachelor's degree or greater (any major)A history of academic and professional successWillingness to travel 25-60% of working days, with a typical month including 1-2 trips lasting 2-4 daysEligible to work in the United States without visa sponsorshipRelocation to the Madison, WI area (reimbursed)COVID-19 vaccination",126,Full-time,Entry level,Project Management and Information Technology,Information Technology & Services,,,,3849820342,https://epic.avature.net/Careers/RegisterMethod?folderId=19220&source=LinkedIn,,Actively Hiring
Project Manager,"New York, NY",2026-03-04,2026-03-04,https://www.linkedin.com/jobs/view/project-manager-at-solomon-page-4378974937?refId=ZrZ%2BJWQ4W8xQ0i8aZRjH5Q%3D%3D&trackingId=LeUswhRQUcYY6iS7NqBMYw%3D%3D&position=6&pageNum=0,Solomon Page,https://www.linkedin.com/company/solomon-page-group?trk=public_jobs_jserp-result_job-search-card-subtitle,"Our client, an entertainment company based in Philadelphia, is seeking a Freelance Project Manager to support their Retail Marketing team. This role will manage the end-to-end lifecycle of marketing projects, coordinating cross-functional teams to ensure work is delivered on time and aligned with program goals.This position is ideal for a highly organized project manager who thrives in a fast-paced environment, can manage multiple projects simultaneously, and collaborates effectively with creative teams.Location: Philadelphia (must be able to work onsite several days per week) Schedule: 40 hours per week Pay Rate: $50/hour Start Date: ASAP Responsibilities:Manage end-to-end project lifecycles, from planning through execution and closeout. Develop and maintain detailed project plans, timelines, and milestone tracking. Coordinate cross-functional teams, including creative, marketing, PR, technical operations, and vendors. Ensure teams stay aligned on deliverables, deadlines, and project goals. Facilitate project meetings and communicate status updates, risks, and next steps to stakeholders. Track project documentation, including approvals, compliance, and requirements. Manage multiple concurrent workstreams supporting larger marketing programs. Identify risks and implement contingency plans and solutions as project needs evolve. Required Qualifications:Experience supporting retail marketing, print, and OOH campaigns. Background in marketing or creative project management. Experience coordinating cross-functional marketing initiatives. Strong organizational, communication, and stakeholder management skills Tools / Skills:Smartsheet Workfront Microsoft 365 If you meet the required qualifications and are interested in this role, please apply today.The Solomon Page DistinctionSolomon Page offers a comprehensive benefit program for hourly employees. We pride ourselves on offering medical, dental, 401(k), direct deposit and commuter benefits to our employees, including freelancers - which sets us apart in the industries we serve.About Solomon PageFounded in 1990, Solomon Page is a specialty niche provider of staffing and executive search solutions across a wide array of functions and industries. The success of Solomon Page reflects an organic growth strategy supported by a highly entrepreneurial culture. Acting as a strategic partner to our clients and candidates, we focus on providing customized solutions and building long-term relationships based on trust, respect, and the consistent delivery of excellent results. For more information and additional opportunities, visit: solomonpage.com and connect with us on Facebook, and LinkedIn.Opportunity Awaits.",53,Contract,Not Applicable,Project Management,Telecommunications,,Dawn Badia,https://www.linkedin.com/in/dawnbadia,4378974937,,,Actively Hiring
Project Manager (Operations) | $70/hr,"Washington, United States",2026-03-07,2026-03-07,https://www.linkedin.com/jobs/view/project-manager-operations-%2470-hr-at-crossing-hurdles-4371754611?refId=IoRLuH7p%2FukEn0YziwPsPA%3D%3D&trackingId=aotxLawUDJIc4zaFDm1dNw%3D%3D&position=18&pageNum=0,Crossing Hurdles,https://www.linkedin.com/company/crossinghurdles?trk=public_jobs_jserp-result_job-search-card-subtitle,"Position: Project Manager IIType: Full-time positionCompensation: $50-$70 per hourLocation: Seattle, WA, USACommitment: 10–40 hours/weekRole ResponsibilitiesCoordinate projects by making detailed plans to accomplish goals and directing the integration of technical activitiesPresent and explain proposals, reports, and findings to clientsRecruit employees, assign, direct, and evaluate their work, and oversee the development and maintenance of staff competenceAnalyze technology, resource needs, and market demand to plan and assess the feasibility of projectsConfer with management, production, and marketing staff to discuss project specifications and proceduresReview and recommend or approve contracts and cost estimatesDirect, review, and approve product designs and changesConsult or negotiate with clients to prepare project specificationsRequirementsStrong verbal and written communication, problem solving, attention to detail, and interpersonal skillsStrong ability to work independently and manage time effectivelyStrong leadership and mentoring skills to provide support and constructive performance feedbackStrong knowledge of production processes, quality control, costs, and techniques for maximizing effective manufacture and distribution of goodsStrong knowledge of business and management principles related to strategic planning, resource allocation, and production methodsStrong knowledge of computer software such as MS Word, MS PowerPoint, MS Project, and VisioBachelor’s degree in business administration or a related fieldPMI or PMP certification preferredApplication Process (Takes 20 Mins)Upload resumeInterview (15 min)Submit form",31,Full-time,Mid-Senior level,"Project Management, Information Technology, and Research",Research Services,,,,4371754611,,,
Project Manager,"South San Francisco, CA",2026-03-03,2026-03-03,https://www.linkedin.com/jobs/view/project-manager-at-soley-therapeutics-4380565829?refId=IoRLuH7p%2FukEn0YziwPsPA%3D%3D&trackingId=dFdQfc21XmLsYmzxWodB6w%3D%3D&position=17&pageNum=0,Soley Therapeutics,https://www.linkedin.com/company/soley-therapeutics?trk=public_jobs_jserp-result_job-search-card-subtitle,"Project Manager – Drug DiscoveryLocation: South San FranciscoAbout UsSoley Therapeutics, https://soleytherapeutics.com/, is a disruptive, small molecule, drug discoverybiotechnology company, based on our co-founders’ decades of peer-reviewed, world-class research from UCSF, Harvard, Stanford, Johns Hopkins, Oxford in cellular stress. Towards this we have pioneered novel, custom robotic high-throughput wet-lab(s) integrated with our own AI-accelerated SW platform. Soley Therapeutics is committed to hiring a world-class team with different skillsets and experiences, with inclusion across race, gender, age, religion and identity. We firmly believe that diversity makes us stronger and cultivates bold innovation.What we are looking for…We are seeking a proactive Project Manager who thrives in a dynamic, startup environment. The ideal candidate is highly organized and takes initiative, demonstrates strong communication and problem-solving skills, exceling in managing projects with ambiguous requirements. What you’ll do…The candidate will be responsible for overseeing and managing early discovery pipeline, including collaborations with Contract Research Organizations (CROs) to ensure project milestones are met on time and within budget. This role requires a keen eye for detail, exceptional communication skills, and the ability to hold external partners accountable for their deliverables. Organize and manage the internal science projects, tracking progress and mitigating risk. Work closely with Director of Science and CSO to scale Soley’s science program, maximizing efficiency and output.Develop and maintain project plans. Monitor project progress and performance, ensuring adherence to agreed-upon timelines and deliverables.Budget management: develop forecast, monitor actuals, manage Purchase Order system.Provide Soley team with project management expertise, including recommendations to strategic planning, project status reports, dashboards, and problem-solving.Interface between CRO, Science, and AI/ML projects (AI/ML experience not required)Required qualifications:3-5 years of experience as a project manager in biotech or pharmaceutical drug development, oncology or neurology experience is a plusBachelor’s degree in science or health related field A self-reliant problem-solver who also excels in teamwork, characterized by superb written and verbal communication abilities, and strong attention to detailA highly organized candidate with stellar interpersonal skills and high emotional intelligence (EQ) who can work both independently and cross functionallyProficiency in project management tools (Microsoft Suite, Smartsheets)Ability to work in a fast paced, startup environment. We want someone who is ready to jump in with both feet and take initiative as our company grows!Preferred qualifications:Direct project management experience in drug discovery or early phase drug developmentBachelor of Science (B.S.) degree in a life sciences or related scientific discipline (e.g., biology, biochemistry, chemistry, biomedical sciences) preferred",200,Full-time,Mid-Senior level,Project Management,Biotechnology Research and Pharmaceutical Manufacturing,,Mehrdad Hamadani,https://www.linkedin.com/in/mhamadani,4380565829,,,
